{
  "schema_version": "1.0",
  "snapshot_id": "SNAP1",
  "version": "1.0",
  "issued_at": "2026-02-19T22:33:51.620740+00:00",
  "paradigm_ref": "paradigm:REG1@1.0",
  "concept_registry_hash": "sha256:06b6f263101987b09ca42e25457531e9e22d08dae810f4cc9bc09730fcc439ca",
  "indicator_map": [
    {
      "indicator_id": "EXAMPLE_INDICATOR",
      "concept_id": "EXAMPLE_CONCEPT",
      "rule_ref": "rules/example_rule@1.0",
      "units": "unitless",
      "window": "P30D"
    }
  ],
  "measurement_schema": {
    "measurements": [
      {
        "measurement_id": "EXAMPLE_MEASUREMENT",
        "indicator_id": "EXAMPLE_INDICATOR",
        "dtype": "float",
        "nullable": false
      }
    ]
  }
}
